{
  "schemaVersion": "1.0.0",
  "fund": {
    "id": "neighborhood-food-resilience-microgrant",
    "displayName": "Neighborhood Food Resilience Microgrant",
    "shortSummary": "Small awards for community-led projects that improve reliable access to fresh food in underserved neighborhoods.",
    "category": "Community resilience",
    "sector": "Food access",
    "audience": [
      "Nonprofit organizations",
      "Public schools",
      "Community coalitions with a fiscal sponsor"
    ],
    "fundingRange": {
      "currency": "USD",
      "min": 5000,
      "max": 25000
    },
    "applicationWindow": {
      "opens": "2026-09-01",
      "deadline": "2026-11-15",
      "timezone": "America/New_York"
    },
    "questionGraphId": "food-resilience-questionnaire",
    "eligibilityRuleSetId": "food-resilience-eligibility-v1",
    "programGuideUrl": "https://<your-tenant>.sharepoint.com/sites/GrantAdvisor/Shared%20Documents/Program%20Guides/Neighborhood-Food-Resilience-Microgrant-Program-Guide.docx",
    "recommendationSignals": {
      "keywords": [
        "food access",
        "pantry",
        "community garden",
        "fresh produce",
        "school families"
      ],
      "goodFit": [
        "Applicant is a nonprofit or public school",
        "Project serves a documented low-access neighborhood",
        "Request is no more than 25000 USD"
      ],
      "poorFit": [
        "Applicant is an individual or for-profit business",
        "Project is primarily commercial retail",
        "Project is outside the service region"
      ]
    }
  },
  "evaluationGuidance": {
    "reviewPriorities": "Start with the hard-disqualifier checks: eligible applicant, in-region low-access food focus, request at or below the cap, and non-commercial project type. Treat the pantry partner and match rules as strengthening signals only after hard criteria are satisfied.",
    "borderlineHandling": "A request even slightly above 25000 USD misses the cap unless the applicant can reduce this fund's ask. A citywide project can meet the service-area rule only when the answer states a clear low-access focus; do not treat general citywide benefit as enough.",
    "definitions": "Use low-access neighborhood to mean the community served, not the applicant's mailing address. Non-commercial food access includes free distribution, pantry logistics, or community growing; standard retail sales alone remain outside scope.",
    "communicationEmphasis": "Use practical community-development language. When a gap appears coachable, point to the specific remediation, such as adding a fiscal sponsor, documenting site access, or naming a supplier, without softening hard-disqualifier criteria."
  },
  "questionGraph": {
    "id": "food-resilience-questionnaire",
    "entryQuestionId": "food-applicant-type",
    "progress": {
      "strategy": "current-path-estimate",
      "unit": "question",
      "displayHint": "Show answered questions over answered plus shortest remaining reachable questions from the current node."
    },
    "questions": [
      {
        "id": "food-applicant-type",
        "prompt": "What type of applicant are you applying as?",
        "helpText": "Choose the legal entity or sponsor that would receive the grant agreement.",
        "answerType": "single-select",
        "required": true,
        "options": [
          {
            "value": "nonprofit",
            "label": "Nonprofit organization",
            "helpText": "Choose this if a 501(c)(3) or equivalent nonprofit would hold and sign the grant agreement."
          },
          {
            "value": "public-school",
            "label": "Public school or school district",
            "helpText": "Choose this if a K–12 public school or school district would sign the agreement on behalf of the project."
          },
          {
            "value": "for-profit-business",
            "label": "For-profit business",
            "helpText": "A business that generates revenue from commercial operations rather than charitable mission."
          },
          {
            "value": "individual",
            "label": "Individual resident",
            "helpText": "A private resident acting without a sponsoring organization or formal legal entity."
          }
        ],
        "edges": [
          {
            "id": "food-applicant-eligible",
            "condition": {
              "answer": "food-applicant-type",
              "in": [
                "nonprofit",
                "public-school"
              ]
            },
            "target": {
              "type": "question",
              "id": "food-service-area"
            }
          },
          {
            "id": "food-applicant-not-eligible",
            "condition": {
              "answer": "food-applicant-type",
              "in": [
                "for-profit-business",
                "individual"
              ]
            },
            "target": {
              "type": "question",
              "id": "food-service-area"
            }
          }
        ]
      },
      {
        "id": "food-service-area",
        "prompt": "Where will the project primarily serve people?",
        "helpText": "Use the neighborhood where most benefits will occur, not the applicant office address.",
        "answerType": "single-select",
        "required": true,
        "options": [
          {
            "value": "low-access-neighborhood",
            "label": "A documented low-access neighborhood",
            "helpText": "A neighborhood with limited nearby grocery or fresh food options, ideally documented by a food access study or USDA food desert designation."
          },
          {
            "value": "citywide-with-low-access-focus",
            "label": "Citywide, with a clear low-access focus",
            "helpText": "The project covers the whole city but deliberately targets and benefits residents in documented low-access areas."
          },
          {
            "value": "outside-region",
            "label": "Outside the eligible service region",
            "helpText": "The project's primary beneficiaries are in a county or metro area outside the fund's eligible geographic boundary."
          }
        ],
        "edges": [
          {
            "id": "food-service-in-scope",
            "condition": {
              "answer": "food-service-area",
              "in": [
                "low-access-neighborhood",
                "citywide-with-low-access-focus"
              ]
            },
            "target": {
              "type": "question",
              "id": "food-request-amount"
            }
          },
          {
            "id": "food-service-outside-region",
            "condition": {
              "answer": "food-service-area",
              "equals": "outside-region"
            },
            "target": {
              "type": "question",
              "id": "food-request-amount"
            }
          }
        ]
      },
      {
        "id": "food-request-amount",
        "prompt": "How much funding are you requesting?",
        "helpText": "Enter the requested grant amount in US dollars. This microgrant caps awards at 25000 USD.",
        "answerType": "currency",
        "required": true,
        "validation": {
          "min": 1,
          "max": 100000
        },
        "edges": [
          {
            "id": "food-amount-within-cap",
            "condition": {
              "answer": "food-request-amount",
              "operator": "lte",
              "value": 25000
            },
            "target": {
              "type": "question",
              "id": "food-project-type"
            }
          },
          {
            "id": "food-amount-over-cap",
            "condition": {
              "answer": "food-request-amount",
              "operator": "gt",
              "value": 25000
            },
            "target": {
              "type": "question",
              "id": "food-project-type"
            }
          }
        ]
      },
      {
        "id": "food-project-type",
        "prompt": "Which project type best describes your request?",
        "helpText": "Pantry, garden, and retail-adjacent projects ask different follow-up questions because their eligibility evidence differs.",
        "answerType": "single-select",
        "required": true,
        "options": [
          {
            "value": "mobile-pantry",
            "label": "Mobile pantry or fresh food distribution",
            "helpText": "Distributes free or low-cost food directly to community members, often by vehicle or pop-up site."
          },
          {
            "value": "community-garden",
            "label": "Community garden or growing site",
            "helpText": "A shared growing space that produces food for community use, donation, or low-cost sale."
          },
          {
            "value": "commercial-retail",
            "label": "Commercial retail expansion",
            "helpText": "A store or market that sells food to paying customers at standard market prices."
          }
        ],
        "edges": [
          {
            "id": "food-project-pantry",
            "condition": {
              "answer": "food-project-type",
              "equals": "mobile-pantry"
            },
            "target": {
              "type": "question",
              "id": "food-pantry-partner"
            }
          },
          {
            "id": "food-project-garden",
            "condition": {
              "answer": "food-project-type",
              "equals": "community-garden"
            },
            "target": {
              "type": "question",
              "id": "food-land-access"
            }
          },
          {
            "id": "food-project-retail",
            "condition": {
              "answer": "food-project-type",
              "equals": "commercial-retail"
            },
            "target": {
              "type": "question",